{
  "$schema": "https://json-schema.org/draft/2020-12/schema",
  "$id": "system_info.schema.json",
  "title": "System Info",
  "description": "Hardware and software metadata for a benchmark submission. Must not contain PII.",
  "type": "object",
  "required": [
    "gpu_model",
    "os_name",
    "os_version",
    "hashcat_version",
    "hashcat_binary_sha256",
    "device_id",
    "timestamp"
  ],
  "properties": {
    "gpu_model": {
      "type": "string",
      "description": "GPU or accelerator model name (e.g. 'Apple M3 Max')"
    },
    "gpu_core_count": {
      "type": ["string", "integer"],
      "description": "Number of GPU cores"
    },
    "gpu_memory_mb": {
      "type": "integer",
      "description": "GPU memory in megabytes"
    },
    "backend": {
      "type": "string",
      "description": "Compute backend (Metal, CUDA, OpenCL)"
    },
    "driver_version": {
      "type": "string",
      "description": "GPU driver version"
    },
    "os_name": {
      "type": "string",
      "description": "Operating system name (macOS, Linux)"
    },
    "os_version": {
      "type": "string",
      "description": "Operating system version"
    },
    "hashcat_version": {
      "type": "string",
      "description": "Hashcat version string"
    },
    "hashcat_commit": {
      "type": "string",
      "description": "Hashcat git commit hash"
    },
    "hashcat_binary": {
      "type": "string",
      "description": "Hashcat binary name (basename only, no paths)"
    },
    "suite_commit": {
      "type": "string",
      "description": "Benchmark suite git commit hash"
    },
    "hashcat_binary_sha256": {
      "type": "string",
      "description": "SHA-256 hash of the hashcat binary",
      "pattern": "^[a-f0-9]{64}$"
    },
    "device_id": {
      "type": "string",
      "description": "Slug-style device identifier (e.g. 'apple-m3-max')",
      "pattern": "^[a-z0-9-]+$"
    },
    "timestamp": {
      "type": "string",
      "description": "ISO-8601 UTC timestamp",
      "pattern": "^\\d{4}-\\d{2}-\\d{2}T\\d{2}:\\d{2}:\\d{2}Z$"
    }
  },
  "additionalProperties": false
}
